{
  "$schema": "http://json-schema.org/draft-07/schema#",
  "$id": "https://bharatkavach.in/schemas/evidence_bundle.schema.json",
  "title": "EvidenceBundle",
  "description": "Bharat Kavach Phase 1 — auditable forensic evidence bundle schema",
  "type": "object",
  "required": [
    "bundle_id",
    "analyzed_at",
    "case_id",
    "sha256_hash",
    "model_registry",
    "chain_of_custody",
    "component_verdicts"
  ],
  "additionalProperties": false,
  "properties": {
    "bundle_id": {
      "type": "string",
      "description": "UUID v4 uniquely identifying this evidence bundle",
      "pattern": "^[0-9a-f]{8}-[0-9a-f]{4}-4[0-9a-f]{3}-[89ab][0-9a-f]{3}-[0-9a-f]{12}$"
    },
    "analyzed_at": {
      "type": "string",
      "description": "ISO 8601 UTC timestamp of when analysis was performed",
      "format": "date-time"
    },
    "case_id": {
      "type": "integer",
      "description": "Foreign key referencing CaseReport.id"
    },
    "sha256_hash": {
      "type": "string",
      "description": "SHA-256 hex digest of canonical bundle payload (all fields except sha256_hash itself)",
      "pattern": "^[0-9a-f]{64}$"
    },
    "model_registry": {
      "type": "object",
      "description": "Maps each component name to the model version/ID used during analysis",
      "additionalProperties": {
        "type": "string"
      }
    },
    "chain_of_custody": {
      "type": "array",
      "description": "Ordered list of processing steps, one entry per invoked component",
      "items": {
        "type": "object",
        "required": ["step", "component", "artifact_type", "action", "timestamp"],
        "additionalProperties": false,
        "properties": {
          "step": {
            "type": "integer",
            "description": "Sequential step number (1-indexed)"
          },
          "component": {
            "type": "string",
            "description": "Name of the AI component that performed this step"
          },
          "artifact_type": {
            "type": "string",
            "description": "Type of artifact processed in this step",
            "enum": ["transcript", "document_image", "currency_image"]
          },
          "action": {
            "type": "string",
            "description": "Human-readable description of the action taken (or serialisation_error message)"
          },
          "timestamp": {
            "type": "string",
            "description": "ISO 8601 timestamp of when this step occurred",
            "format": "date-time"
          }
        }
      }
    },
    "component_verdicts": {
      "type": "object",
      "description": "Verdict objects for all four AI components; always contains exactly four keys",
      "required": [
        "BehavioralClassifier",
        "LegalRAG",
        "VisionForensics",
        "CurrencyVerifier"
      ],
      "additionalProperties": false,
      "properties": {
        "BehavioralClassifier": { "$ref": "#/definitions/ComponentVerdict" },
        "LegalRAG":             { "$ref": "#/definitions/ComponentVerdict" },
        "VisionForensics":      { "$ref": "#/definitions/ComponentVerdict" },
        "CurrencyVerifier":     { "$ref": "#/definitions/ComponentVerdict" }
      }
    }
  },
  "definitions": {
    "ComponentVerdict": {
      "type": "object",
      "description": "Output verdict from a single AI component",
      "required": ["verdict", "confidence", "details"],
      "additionalProperties": false,
      "properties": {
        "verdict": {
          "type": "string",
          "description": "Human-readable verdict string; 'not_applicable' when the component was not invoked"
        },
        "confidence": {
          "description": "Model confidence score in [0.0, 1.0]; null when component was not invoked",
          "oneOf": [
            {
              "type": "number",
              "minimum": 0.0,
              "maximum": 1.0
            },
            { "type": "null" }
          ]
        },
        "details": {
          "description": "Component-specific structured output; null when component was not invoked",
          "oneOf": [
            { "type": "object" },
            { "type": "null" }
          ]
        }
      }
    }
  }
}