{
  "bundle_id": "ae2b1e19-7e7c-46cf-91d7-de9f335deed3",
  "analyzed_at": "2026-07-18T12:08:21.935Z",
  "case_id": 1,
  "sha256_hash": "330fcce10aa0009a553bd1b0665c3cacc47643534a51a6458592b90bbd84afc8",
  "model_registry": {
    "BehavioralClassifier": "unknown",
    "LegalRAG": "unknown",
    "VisionForensics": "unknown",
    "CurrencyVerifier": "unknown"
  },
  "chain_of_custody": [],
  "component_verdicts": {
    "BehavioralClassifier": {
      "verdict": "not_applicable",
      "confidence": null,
      "details": null
    },
    "LegalRAG": {
      "verdict": "not_applicable",
      "confidence": null,
      "details": null
    },
    "VisionForensics": {
      "verdict": "not_applicable",
      "confidence": null,
      "details": null
    },
    "CurrencyVerifier": {
      "verdict": "not_applicable",
      "confidence": null,
      "details": null
    }
  }
}